[
  {
    "id": "capacitive-lick-detector",
    "name": "Capacitive Lick Detector",
    "category": "Sensors/Touch Sensors",
    "description": "A high-precision capacitive touch sensor designed for detecting lick events in head-fixed mouse behavioural experiments. Offers sub-millisecond temporal resolution with minimal electrical noise.",
    "authors": [
      "Sainsbury Wellcome Centre"
    ],
    "image": "assets/images/lick-detector.webp",
    "link": "https://github.com/SainsburyWellcomeCentre/capacitive-lick-detector",
    "tags": [
      "capacitive",
      "lick detection",
      "head-fixed",
      "behavioural"
    ],
    "specs": {
      "Type": "Capacitive",
      "Response Time": "<1 ms",
      "Interface": "BNC",
      "Output": "Digital TTL"
    }
  },
  {
    "id": "si-photodetector",
    "name": "Silicon Photodetector Module",
    "category": "Sensors/Photodetectors",
    "description": "A low-noise silicon photodetector module optimised for measuring fluorescence signals in fibre photometry setups. Includes integrated transimpedance amplifier.",
    "authors": [
      "Paris Brain Institute (ICM)"
    ],
    "image": "assets/images/photodetector.webp",
    "link": "https://github.com/ICM-Institute/si-photodetector",
    "tags": [
      "fiber photometry",
      "fluorescence",
      "silicon",
      "low-noise"
    ],
    "specs": {
      "Wavelength": "400–700 nm",
      "Sensitivity": "0.5 A/W",
      "Interface": "SMA fibre connector",
      "Output": "Analog voltage"
    }
  },
  {
    "id": "linear-actuator-controller",
    "name": "Stepper Actuator Controller",
    "category": "Actuator Controllers/Stepper Motor Controllers",
    "description": "An open-source stepper motor controller for linear actuators used in reward delivery and stimulus presentation. Supports serial and TTL triggering.",
    "authors": [
      "Sainsbury Wellcome Centre"
    ],
    "image": "assets/images/actuator-controller.webp",
    "link": "https://github.com/SainsburyWellcomeCentre/stepper-actuator-controller",
    "tags": [
      "stepper",
      "reward delivery",
      "stimulus",
      "TTL"
    ],
    "specs": {
      "Motor Type": "Bipolar stepper",
      "Driver IC": "TMC2209",
      "Interface": "USB serial / TTL",
      "Microstepping": "Up to 1/256"
    }
  },
  {
    "id": "fablabs-kicad-library",
    "name": "KiCad Library",
    "category": "Libraries/Electronics/KiCad",
    "description": "A collection of reusable components for use in KiCad schematic and PCB design.",
    "authors": [
      "Sainsbury Wellcome Centre"
    ],
    "image": "assets/images/logo-kicad.svg",
    "link": "https://github.com/SainsburyWellcomeCentre/fablabs-kicad-library.git",
    "tags": [
      "kicad",
      "library"
    ],
    "specs": {
      "Type": "KiCad"
    }
  },
  {
    "id": "harp.device.lickety-split",
    "name": "Lickety Split",
    "category": "Sensors/Touch Sensors",
    "description": "An ephys-compliant lick detector with Harp message protocol",
    "authors": [
      "Allen Institute"
    ],
    "image": "assets/images/harp.device.lickety-split.png",
    "link": "https://github.com/AllenNeuralDynamics/harp.device.lickety-split.git",
    "tags": [
      "capacitive",
      "lick detection"
    ],
    "specs": {
      "Type": "Capacitive",
      "Response Time": "<1 ms",
      "interface": "SMA (TTL), USB-C"
    }
  }
]